{
  "meta": {
    "title": "The AI Loop",
    "tagline": "The circular economy of AI, mapped.",
    "lastUpdated": "2026-06-21",
    "lastUpdatedLabel": "21 June 2026",
    "note": "Compiled from public reporting. 'Reported' and 'letter of intent' figures are not confirmed cash. Not investment advice.",
    "pricesAsOf": "2026-06-21",
    "sourcesNote": "Each deal links to a primary announcement or major-outlet report. Status reflects our reading of the latest reporting, not the source alone. Share prices are dated snapshots, not individually cited."
  },
  "tape": [
    {
      "label": "NVDA",
      "value": "~$5.1T market cap"
    },
    {
      "label": "2026 CAPEX",
      "value": "~$725–800B planned"
    },
    {
      "label": "HYPERSCALER AI REV",
      "value": "~$25B in 2025"
    },
    {
      "label": "MAG 7",
      "value": "33.8% of the S&P 500"
    },
    {
      "label": "OPENAI",
      "value": "~$852B · filed to IPO"
    },
    {
      "label": "ANTHROPIC",
      "value": "~$965B · run-rate ~$47B"
    },
    {
      "label": "SPACEX",
      "value": "~$1.75T IPO · raised ~$75B"
    },
    {
      "label": "xAI",
      "value": "~$250B · now part of SpaceX"
    },
    {
      "label": "COLOSSUS",
      "value": "Anthropic rents it ~$1.25B/mo"
    },
    {
      "label": "STARGATE",
      "value": ">$400B committed"
    },
    {
      "label": "HBM",
      "value": "sold out into 2027",
      "teal": true
    },
    {
      "label": "NUCLEAR",
      "value": "~13 GW signed",
      "teal": true
    },
    {
      "label": "GE VERNOVA",
      "value": "$163B backlog",
      "teal": true
    },
    {
      "label": "E-WASTE",
      "value": "22.3% recycled",
      "teal": true
    },
    {
      "label": "AMD",
      "value": "warrant ~10% to OpenAI"
    },
    {
      "label": "MSFT",
      "value": "owns ~27% of OpenAI"
    }
  ],
  "nodes": [
    {
      "id": "nvidia",
      "name": "Nvidia",
      "type": "Chipmaker",
      "x": 500,
      "y": 390,
      "big": true
    },
    {
      "id": "openai",
      "name": "OpenAI",
      "type": "Model lab",
      "x": 290,
      "y": 320,
      "big": true
    },
    {
      "id": "anthropic",
      "name": "Anthropic",
      "type": "Model lab",
      "x": 250,
      "y": 560
    },
    {
      "id": "xai",
      "name": "xAI",
      "type": "Model lab",
      "x": 735,
      "y": 205
    },
    {
      "id": "microsoft",
      "name": "Microsoft",
      "type": "Hyperscaler",
      "x": 275,
      "y": 135
    },
    {
      "id": "amazon",
      "name": "Amazon",
      "type": "Hyperscaler",
      "x": 110,
      "y": 445
    },
    {
      "id": "alphabet",
      "name": "Alphabet",
      "type": "Hyperscaler",
      "x": 160,
      "y": 650
    },
    {
      "id": "meta",
      "name": "Meta",
      "type": "Hyperscaler",
      "x": 485,
      "y": 680
    },
    {
      "id": "oracle",
      "name": "Oracle",
      "type": "Cloud",
      "x": 545,
      "y": 150
    },
    {
      "id": "coreweave",
      "name": "CoreWeave",
      "type": "Neocloud",
      "x": 705,
      "y": 505
    },
    {
      "id": "amd",
      "name": "AMD",
      "type": "Chipmaker",
      "x": 805,
      "y": 585
    },
    {
      "id": "broadcom",
      "name": "Broadcom",
      "type": "Chipmaker",
      "x": 890,
      "y": 400
    },
    {
      "id": "softbank",
      "name": "SoftBank",
      "type": "Capital",
      "x": 95,
      "y": 250
    },
    {
      "id": "spacex",
      "name": "SpaceX",
      "type": "Neocloud",
      "x": 645,
      "y": 600
    },
    {
      "id": "arm",
      "name": "Arm",
      "type": "Chip IP",
      "x": 500,
      "y": -30,
      "ext": true
    },
    {
      "id": "asml",
      "name": "ASML",
      "type": "Equipment",
      "x": 821,
      "y": 48,
      "ext": true
    },
    {
      "id": "samsung",
      "name": "Samsung",
      "type": "Memory",
      "x": 985,
      "y": 185,
      "ext": true
    },
    {
      "id": "skhynix",
      "name": "SK Hynix",
      "type": "Memory",
      "x": 1054,
      "y": 340,
      "ext": true
    },
    {
      "id": "tsmc",
      "name": "TSMC",
      "type": "Foundry",
      "x": 1041,
      "y": 511,
      "ext": true
    },
    {
      "id": "micron",
      "name": "Micron",
      "type": "Memory",
      "x": 929,
      "y": 676,
      "ext": true
    },
    {
      "id": "smci",
      "name": "Super Micro",
      "type": "Servers",
      "x": 692,
      "y": 804,
      "ext": true
    },
    {
      "id": "vertiv",
      "name": "Vertiv",
      "type": "Infrastructure",
      "x": 355,
      "y": 815,
      "ext": true
    },
    {
      "id": "oklo",
      "name": "Oklo",
      "type": "Energy",
      "x": 60,
      "y": 735,
      "ext": true
    },
    {
      "id": "constellation",
      "name": "Constellation",
      "type": "Energy",
      "x": -58,
      "y": 437,
      "ext": true
    },
    {
      "id": "nebius",
      "name": "Nebius",
      "type": "Neocloud",
      "x": 2,
      "y": 148,
      "ext": true
    },
    {
      "id": "gev",
      "name": "GE Vernova",
      "type": "Power",
      "x": 175,
      "y": 860,
      "ext": true
    },
    {
      "id": "eaton",
      "name": "Eaton",
      "type": "Power",
      "x": 490,
      "y": 875,
      "ext": true
    },
    {
      "id": "marvell",
      "name": "Marvell",
      "type": "Chipmaker",
      "x": 1115,
      "y": 150,
      "ext": true
    }
  ],
  "edges": [
    {
      "from": "nvidia",
      "to": "openai",
      "kind": "Equity investment",
      "group": "invest",
      "amt": "Up to $100B",
      "status": "loi",
      "source": "https://openai.com/index/openai-nvidia-systems-partnership/",
      "verified": "2025-09-22"
    },
    {
      "from": "openai",
      "to": "nvidia",
      "kind": "Chip purchases",
      "group": "spend",
      "amt": "10+ GW of systems",
      "status": "reported",
      "source": "https://openai.com/index/openai-nvidia-systems-partnership/",
      "verified": "2025-09-22"
    },
    {
      "from": "microsoft",
      "to": "openai",
      "kind": "Equity stake",
      "group": "invest",
      "amt": "~27% · $13.8B in",
      "status": "confirmed",
      "source": "https://blogs.microsoft.com/blog/2025/10/28/the-next-chapter-of-the-microsoft-openai-partnership/",
      "verified": "2025-10-28"
    },
    {
      "from": "openai",
      "to": "microsoft",
      "kind": "Cloud commitment",
      "group": "spend",
      "amt": "$250B Azure",
      "status": "confirmed",
      "source": "https://blogs.microsoft.com/blog/2025/10/28/the-next-chapter-of-the-microsoft-openai-partnership/",
      "verified": "2025-10-28"
    },
    {
      "from": "openai",
      "to": "oracle",
      "kind": "Cloud commitment",
      "group": "spend",
      "amt": "~$300B / 5 yrs",
      "status": "reported",
      "source": "https://www.theregister.com/special-features/2025/11/04/nvidia-openai-and-the-trillion-dollar-loop/",
      "verified": "2025-09-10"
    },
    {
      "from": "oracle",
      "to": "nvidia",
      "kind": "Chip purchases (Stargate)",
      "group": "spend",
      "amt": "GPU buildout",
      "status": "reported",
      "source": "https://openai.com/index/announcing-the-stargate-project/",
      "verified": "2025-01-21"
    },
    {
      "from": "amd",
      "to": "openai",
      "kind": "Warrant (equity)",
      "group": "invest",
      "amt": "Warrant ~10% of AMD",
      "status": "confirmed",
      "source": "https://ir.amd.com/news-events/press-releases/detail/1260/amd-and-openai-announce-strategic-partnership-to-deploy-6-gigawatts-of-amd-gpus",
      "verified": "2025-10-06"
    },
    {
      "from": "openai",
      "to": "amd",
      "kind": "Chip purchases",
      "group": "spend",
      "amt": "6 GW Instinct",
      "status": "confirmed",
      "source": "https://ir.amd.com/news-events/press-releases/detail/1260/amd-and-openai-announce-strategic-partnership-to-deploy-6-gigawatts-of-amd-gpus",
      "verified": "2025-10-06"
    },
    {
      "from": "amd",
      "to": "meta",
      "kind": "Warrant + supply",
      "group": "invest",
      "amt": "Warrant + 6 GW",
      "status": "reported",
      "source": "https://www.tomshardware.com/tech-industry/artificial-intelligence/amd-meta-100-billion-deal",
      "verified": "2026-02-24"
    },
    {
      "from": "nvidia",
      "to": "coreweave",
      "kind": "Equity + backstop",
      "group": "backstop",
      "amt": "~11.5% + $6.3B backstop",
      "status": "confirmed",
      "source": "https://www.fool.com/investing/2025/10/05/coreweave-nvidia-6-3-billion-backstop-explained/",
      "verified": "2025-10-05"
    },
    {
      "from": "coreweave",
      "to": "nvidia",
      "kind": "Chip purchases",
      "group": "spend",
      "amt": "GPU purchases",
      "status": "confirmed",
      "source": "https://www.fool.com/investing/2025/10/05/coreweave-nvidia-6-3-billion-backstop-explained/",
      "verified": "2025-10-05"
    },
    {
      "from": "microsoft",
      "to": "coreweave",
      "kind": "Anchor customer",
      "group": "spend",
      "amt": "Capacity rental",
      "status": "confirmed",
      "source": "https://www.bloomberg.com/graphics/2026-ai-circular-deals/",
      "verified": "2026-03-11"
    },
    {
      "from": "openai",
      "to": "coreweave",
      "kind": "Capacity deal",
      "group": "spend",
      "amt": "Multi-year",
      "status": "confirmed",
      "source": "https://www.bloomberg.com/graphics/2026-ai-circular-deals/",
      "verified": "2026-03-11"
    },
    {
      "from": "meta",
      "to": "coreweave",
      "kind": "Capacity deal",
      "group": "spend",
      "amt": "~$14.2B",
      "status": "reported",
      "source": "https://www.bloomberg.com/graphics/2026-ai-circular-deals/",
      "verified": "2026-03-11"
    },
    {
      "from": "nvidia",
      "to": "xai",
      "kind": "Equity investment",
      "group": "invest",
      "amt": "Up to ~$2B",